86,2018/6/14 19:24:10,5541秒,链接,直接访问,221.6.82.178(江苏-苏州),不认识,你打错电话了,我不是,说,号码我刚办的,你哪位,他在开车,我是他朋友,我在忙,等会再打,什么事情,我在上班，等会联系,嗯,怎么了,在开车不方便,过两天处理,我现在在忙,不认识,干嘛,我在睡觉,你是不是有病啊,诈骗电话,在打投诉,总是打我电话干嘛,我这边好吵,信号不好,再说一次,投诉你们,怎么老是打电话,神经病,联系不上,找不到,坐牢了,出国了,他还欠我钱没有还,认识,帮忙通知,我是他姐姐,只是朋友,怎么啦,不认识,没听说过,你是哪位,在打就不接,打错了,再打要报警,你们起诉吧,不要打电话了,不说话,我听不见,你是不是有病啊,诈骗电话,在打投诉,总是打我电话干嘛,怎么老是打电话,信号不好,神经病,我这边好吵,再打报警,再说一次,银行卡丢了,我没有钱,利息太高了,我可以先还一部分吗,能不能少点,忘记了,可以分期吗,我出事了,这边还能少点吗,坐牢了,我月底处理,我等会就去处理,等发工资就处理,我知道了,怎么还,账号多少,一定会还,我会处理的,现在还有多少,马上好,我没有钱,你们利息太高了,我已经还了,你们起诉吧,过段时间,不还了,我在哪里的欠款,工作人员态度不好,你说什么,敷衍,马上处理,在银行,我没有钱,我已经还了,敷衍,等会,在银行,马上就好,我在开会,等会来电,好的,三天后,知道了,没问题,马上就还了,等一下,现在在弄,转好了,处理好发凭条,等下去银行,三天还不了,钱没有到账,我再看看,我在筹钱,再给点时间,还不起,借不到钱,等发工资,这两天有事,利息高,没有钱,已经还了,不还了,我知道,嗯,好的,马上处理,一定会处理好的,知道了,好的,谢谢,我同意,马上,我知道,等会,好的,一定处理好,没问题,知道了,等会发凭条,我没有工作,能不能减免,利息太高了,没有钱,我在医院里,等会让朋友去还,钱还没有到位,再等几天,能不能分期还,在银行,我知道,能不能减免,好的,我知道,没有钱,没有工作,在坐牢,工作不稳定,能不能减免点,能不能分期还,我不方便,钱没有到位,马上在银行,等会就好,能不能在少点,找借口,等会,我在吃饭,银行不让还,能不能分期还,我不方便,钱没有到位,马上在银行,等会就好,能不能在少点,能不能分期还,找借口,等会,我在吃饭,银行不让还,我不方便,钱没有到位,马上在银行,等会就好,能不能分期还,能不能在少点,银行不让还,找借口,我在吃饭,等会
87,2018/6/14 19:24:12,5972秒,微信,N/A,122.195.164.138(江苏-宿迁),不是,打错了,待会再打过来,不认识,号码是刚办的,不要打这个电话了,再打投诉你,你自己去找他,就不告诉你,谁啊,是啊,有什么事吗,对,有事说,你是哪里,你打错了,我认识你吗,你好,你是干什么的,不要保险,你说什么,你大点声,你待会打过来吧啊,我听不懂你说什么,手机是我捡到的,号码刚办的,号码是公司的号码,你找他干什么,你管我是谁,他是谁啊,认识,不认识,你打错了,找他干嘛,你是哪里,有什么事吗,在开车,等会打过来,联系不到,请不要在打这个电话了,不认识,没听过,这人谁啊,你找我干嘛,你找他啊,不好意，你打错了,电话刚办的,你找这个人没印象,这里没这个人,这人是干什么的,风太大，没听清,今天天气真好,你说什么,你是哪里,你待会打过来吧啊,号码刚办的,听不懂普通话,你说什么,听不清楚,大点声,利息太高,客服骂人,爆我通讯录给个说法,占时没钱还,有钱就还了,资金链断了，再想办法处理。,没有工作，等找到工作有钱就还,欠的钱太多了，还不起,凭本事借的，为什么要还,马上处理,马上处理,最迟下午处理掉,给我一个月时间,最迟月底处理,十五号发工资,正在筹钱,正向朋友借钱,下午别人就转钱给我处理,别联系我家人，我马上处理,能减免吗,没钱还,没工作,欠款太多,只还本金,等有钱再还,等会再打过来,在开会,在开车,在高速上,在去银行的路上,家人正在帮忙筹钱,正在想办法,借不到钱，想处理,在开会,开车呢，待会再打,在高速上回家才能处理,在出差无法还款,钱是借给别人用的，等他钱还我了再还。,别人钱我钱，正在要钱,家里车房子正在拍卖,可以,保证还上,尽量吧,放心，一定处理,没问题,时间够了,要不了那么长时间,还不上你看着办,尽我最大努力,没事，你放心吧,可能不行,时间太短了,再多给点时间,只还本金可以,这么短时间借不到这么多钱,还不上,回不去,工资发不了,没办法,抱歉,尽量吧,可能不行,有钱肯定还上,到时候联系你,你提前联系我,我尽快处理,正在想办法,工资不确定发不发,信号不好,再说吧,好的,当然可以,没问题,五分钟之内还上,谢谢你,还了就没事了是吧,这样就没有压力了,我尽快想办法处理,今天保证还上,没问题,只还本金,接受不了,还是太多,还不起,实在困难，没钱还,在去协商吧,不是不还，真多没那么多,就这么多，多一分都没有,利息还是太高，不会处理,不接受,行吧，想办法,我会转达他的,今天可能还不上,工资还没发,尽量吧,不能保证处理掉,占时没钱,钱没到账,应该能还上,想办法借钱,这样勉强接受,可以先还部分,想办法吧,最多先还五百,能少还一些吗，只有这么多,没问题,马上还上,还上就别联系我家人了,下午处理,好的,没钱,工资没发,借不到,欠款太多没办法,到时候一起还上,有钱就还了,不用说太多,要不你借一点给我,我有钱我还能不还吗,只能有钱才还,再说吧,你吃了吗,我在考虑考虑,可能还不上,尽量吧,占时没钱，不知道能不能借到,工资发了就还,在想想办法吧,我不方便,在开会，等会再说
88,2018/6/14 19:32:45,3913秒,微信,N/A,122.195.164.138(江苏-宿迁),我不是,你打错了,我是他同事他出去了,号码刚办的,不是他欠我钱手机抵押了,不要在打我电话了,不关 我的事,你找他本人,你们报警吧,你们起诉吧,没钱 有钱就还,之前出了点事 过几天就还,我在忙 等会说,之前手机掉了,APP登不上去了,忘记了马上处理,哦知道了,你管我啊,滚,你来我就还,风太大 听不清,你管我谁,干嘛 有什么事说,你是不是有病啊,不要在打我电话,说什么听不懂,我在忙,什么事说,不知道,再打投诉你,嗯认识 我在忙,好长时间不联系了,认识不熟,认识 我在外地不知道情况 或债在外地,我是他同事 他不干了没联系,朋友,一个村的,吃过饭,同学,我问一下,不认识,不知道,关你什么事,你打错了,不认识号码刚买的,你们自己不能查啊,不要在打我电话,你有病啊,没听过,什么没听懂,我在忙,我在开车,不知道,哦,知道了,什么事,干嘛,不要打我电话,你们起诉吧,有病啊,利息太高了,能不能分期啊,我先还一点,我会慢慢还,我尽量,我生意失败了,我想想办法,应该可以吧,好的,能少一点吗,能不能减免啊,能不能分期啊,我马上处理,我明天处理,我这个月发工资就还,朋友转账给我,我现在去存钱,我马上提现,月底就还,给我点时间,没钱,利息大高,我尽快,有钱就还,过段时间就还,我没贷,身份证掉了,手机掉了,知道 了,你来拿吧,欠多少钱,等等联系你,我在忙,我在开车,我在开会,知道了,等发工资,别人还没还我钱了,我欠了好多,能不能少点啊,可以,没问题,尽量,钱没到,知道了,嗯,好的,马上,行,肯定,时间太短,钱太多,利息高,知道了,我在想办法,正在筹钱,尽量,不确定,钱到就还,工资没到,知道了,钱到就还,朋友没给我,等会,信号不好,没听清,马上就好,转账,提现,好的,可以,太高了,能不能在少点,知道了,我尽量,我想想办法,我同意,没问题,还不起,没钱,太多了,没那么多钱,我在住院,家里有事,能不能在少点,手里紧张,我欠了好多钱,生意失败了,我看一下,我回去商量一下,我是他姐姐,我是他朋友,我是他父母,正在凑钱,我欠钱太多了,我尽量吧,我看看吧,我问一下,我商量一下,什么没听清楚,可以,生意失败了,没钱,我想想办法,等会,我在忙,我在开会,马上,太多了,知道了,少一点吧,等会,明天吧,没到账,工资没法,朋友出了事情,还不够,我在开会,下午吧,微信说,不方便,钱没到账,等会的,我在忙,下午联系你,明天可以吗,能不能在给点时间,正在凑钱,有事,我在开会
89,2018/6/14 19:37:41,3640秒,链接,直接访问,221.6.82.178(江苏-苏州),我不是打错了，挂,是，哪位 什么事,喂，听不见,骂人,又慌说不是本人，你们自己找他,是，/好的，会处理/敷衍,你们骗子，挂,我在忙，,没空，等下回电,号码新办的，不认识,是，没联系了，转告不了,你们自己找他，不管,说骚扰就挂,提债就骂人,嗯，好的，转告试试,你们起诉，不要再打电话了,我在忙，挂,会去转告他处理,天天打电话给我，烦死了,他说不还，你们自己联系,不是，打错了挂,是，怎么了,你们有病,太吵，听不见,你们谁呀,滚,好的,干嘛,行，知道了,自己找他,嗯，可以让他回电话,不认识,知道了,认识，会转告,好,听不见,信号不好,没空,傻B,打了好多电话，不认识，不知道，,不知道此人,我联系看看,好的,知道了,已经转告了,傻B,听不见,你们谁呀,不认识,不管,不讲话/听他们说,知道了,傻B,你们谁呀,说什么事,转告不了,你们找他,可以,我在忙,好了,利息高，还不了,知道了,行了，在忙，等下,会还的,要减免,傻B，操,现在没钱呀,等有钱,好了，好了,你们是骗子,等发工资,行,好，10号还,好了好了,我等下,我月底,减免还,借钱,让朋友处理,好的，现在没空,不还,你们起诉,等有钱,让朋友还,不是我借的,我不相信你们,骂人,慢慢还,现在没空,有钱再说,在忙,等下说,好的,我想想,没钱,只还本金,在开车,等月底,借钱再去还,没工作，以后再说,可以,不行,我去想想,行的,会还的，别催,金额高了,还要再等等,时间紧，不还,明天再谈,等下说,你们高利贷,不行，以后再说,行的，可以,去借钱,等下说,时间太急，不还,开车,好了好了,我去想想办法,要减免下,听不见,高利贷吗,在忙,要减免下,时间太急，不还,行的，可以,还要再等等,我去想想办法,等下说,不行，以后再说,信号不好,好的,行谢谢,在忙,我去想想办法,减免下,等下说,听不见,会还的，别催,在银行,听不见,行谢谢,好的,时间太急,在银行,减免下,马上好的,谢谢,在开会,等下说,马上还款,没问题,好的,知道了,正在处理,听不见,没空,等下,行了,没工作,可以,等有钱,没工作,借不了钱,今天不行,能不能分期,要再减免,银行不让还,先还一点,好,借不了钱,好,能不能分期,等有钱,先还一点,可以,没工作,借不了钱,今天不行,再看看,我不方便,再看看,明天还款,好了,谢谢,会还的,利息太高,没空,没钱了,等下个月发工资
90,2018/6/14 19:43:42,4507秒,微信,N/A,153.101.165.207(江苏-镇江),我不是,你找错人了,他正在开车,他出去了,这是张三号码，现在给我用了,他被抓了，手机留在家,这个电话是我捡的,这个号码是我自己刚买的,他去外地了，他不用了,他已经死了,恩，我是,我是，你是谁？,你哪里的？找我做什么,我是，我在上班，等我下班再说,是，我在高速上，现在不能接电话,我是，现在不方便接电话，晚点再说,是我啊。咋地啦,恩，你打我电话干嘛,是我，你一直打电话骚扰我干嘛啊,你什么地方的？怎么有我电话,我听不懂你说什么,信号不好,你说话声音太小了,你在哪里打的电话,你是哪里人,你是不是没事干,不要一直打电话骚扰我,你说我是谁,你找谁啊,你自己不会查啊,认识,我是他同事,我是他同学,我是他朋友,我是他房东,他在开车，现在不方便接电话,他在睡觉，晚点给你回电话,认识，但是两三年没联系了,认识，他还欠我钱没还呢,以前认识，我也找不到他,不认识,没听过这个人,这人谁啊,不认识，你打错电话了吧,你找张三打我干嘛,你有病吧，不认识,你不要打我电话，我不认识什么张三李四王二麻的,你查清楚再打电话，我怎么知道谁是张三,不认识不认识，关我屁事,姓张的这么多，我还能都认识啊,你管我认不认识,你不知道我认不认识，你打我电话干嘛,你自己不会查啊,你谁啊？,你哪里的啊？打我电话干嘛啊,你打谁电话你不知道啊,你那边声音太小了，不知道你在说什么,你神经病吧，乱打电话,你不要骚扰我，我没空,我愿意认识就认识，不愿意就不认识,利息太高了,你们是高利贷吧,钱太多了，一次性还不了,可以少一点么？我实在没钱,我现在没有工作，拿不出来那么多钱,我欠了很多贷款，只能还一部分,我只还本金，利息给我减掉,你们工作人员态度不好，不给我减免我就不还了,让你们主管找我，给我减成本金，我就考虑还,我现在只有这么多，能减我就还，不能就等我有钱再说吧,现在遇到困难，我马上想办法,给我点时间，我跟家里人凑点,我月底发工资就还,我先还一部分吧，剩下的我再想办法,我等会处理,我明天处理,我马上去借钱还进去,我找老板预支工资还给你们,我货款到账马上就还了,给我两天时间，我自己还进去,没钱,我凭本事借的钱，凭什么要还,我没有借过贷款,我早就还完了,我有钱了再说,我现在没工作，没钱还,我贷款太多了，现在没钱还,我就不还了，随便你们怎么办,你们来找我我就还,有本事你们报警啊，让警察找我要,我在高速上，挂了啊,你是骗子吧,你再打我电话我就投诉你,你这个号码打过来怎么是显示骚扰电话,我在上班，下班再说,在开会，晚点联系你,你这是什么电话打过来的,你那边信号不好吧，断断续续的,我听不懂你在说什么,我现在在山里，等我回城里再说,可以,明天还进去,可以，马上就还,没问题的,好的好的,行啊，我肯定还进去的,你放心，我准时还进去,可以，你到时候直接查账单,我说话算话，肯定还,必须的，你放心吧,时间太短了,可能还不了,我不一定能凑到钱,我尽量吧，钱不够我也没办法,工资不到账我也没办法,我想想办法吧,我尽量找亲戚借吧,这么多钱，一下子凑不齐,再多给几天时间吧,这个不是我说了算的，我也想马上还进去,我看情况,我待会再联系你,这里信号不好,你那边信号不好,我手机没电了。先充电了,我要去开会了，晚点再说,我先接个电话,我家里来人了，先挂了,我们老板来了，我挂了,你说什么？没听见,可以,好的,谢谢,我同意,我马上还,行，我马上打钱,可以可以，我现在就去借钱,谢谢，我今天肯定还进去,只要不还利息，一定今天还,这个金额我能接受，可以,还是太高了,减免力度太小了,还可以再减免一些么,我确实没那么多钱,能不能本金也少还一点,你再帮我申请一次，再少点我就还,才减这么点，太少了,我没这么多钱，你帮我再问问,我今天还不进去这么多,我只还本金的一半，不然就不还了,我在骑车,风太大了，听不见,你那边信号不好,你说话声音太小了,今天几号啊,我要上班了,我马上要开会了,我手机没电了,你等我下班再说吧,我刚刚过马路，没听见你说话,可以先还,这部分我还得起,可以，我现在还进去,可以，我马上去借钱,好的，五点之前还进去,这个没问题的,谢谢，我肯定还进去,恩恩，我一会转过去,这样可以，没问题,你早这么说我早还了，马上,可以再延期一个月么,给我两个月吧,明天我再还吧,你先申请下来再说,我这两天就还进去,你给我申请吧，我尽量吧,延期再减免成本金吧,哦，才一个月不行,时间太短了，不行,我肯定还，但今天还不了,你吃饭了么,我没空现在,我要睡觉了,我手机没电了，明天再说,我要去开会了,我马上要出差，你过几天给我打吧,你说话声音太小了,我在山里信号不好,你们能拿多少钱工资啊,我有电话进来了，一会再说吧
91,2018/6/14 19:48:12,7079秒,链接,直接访问,157.0.103.142(江苏-南京),不是。,你打错了吧？,我是他朋友。,我不认识他。,这是我刚办理的号码。,我是他同事,接通不说话,他在开会,他出去了,他出去了手机没带,嗯。,是的。,是我。,有什么事。,"我是,你是哪位?",我在上班稍后联系。,我在开会稍后联系。,我正在开车待会回电给你。,我现在不方便接电话。,我有事加我微信说吧。,张三是谁？,我这边信号不好。,风太大，听不清。,你那边太吵，听不清。,是不是关你什么事？,我是他朋友，他出去了。,我是他同事，他没带手机。,你找他有什么事情？,不是啊，怎么了？,是又怎样，不是又怎样？,他以前是我同事。,他是我朋友。,我是他姐姐。,我是他哥哥。,我是他父亲。,我是他亲戚。,好久以前的朋友。,一起打过牌不熟。,一起吃过几次饭不太熟。,他在忙，待会回电给你吧。,不认识。,根本不知道这个人。,没听过。,压根就不认识。,你打错了吧，不认识。,男的女的？,我刚换的号码。,打错了。,张三是谁？,我怎么可能认识？,有点印象，,听过，好像不认识,以前好像以前打过牌，不认识,一起吃过饭，不认识。,你那边太吵，听不清,我这边信号不好，,风太大，,没听过这个人,好像认识，又想不起来。,不知道,我没那么多钱。,可以减免吗。,我欠的多，还不了那么多。,可以分期还吗？,你们的利息太高，还不了。,还本金我就还。,我拿不出那么多钱。,可以免掉利息吗？,可以把利息减少一点吗？,我有事耽误了，帮我减免。,我现在在忙，等下我看一下。,明天吧，看着处理掉。,我现在没钱，过几天吧。,我十五号发工资，到时候还。,我月初发工资再处理吧。,我月底发工资就还上。,家人在帮忙筹钱，就这几天,下午我就处理掉。,明天吧，现在在忙。,我有钱了就还。,我现在没钱。,我没贷款啊。,过段时间再说吧。,现在忙，没时间。,过两天再说。,最近有事情，没时间。,这是我朋友贷的，我不还。,我身份证丢了，没贷款。,有钱再说吧。,别打电话了，有钱我再还。,最近没有钱。,刚上班，还没发工资。,醉驾刚出来，想办法周转,坐牢出来，没钱。,我现在忙，没时间。,信号不好，听不见。,风太大，听不清。,你那边太吵了，听不见。,我在开车，稍后再打。,家里有事，暂时没钱。,好的，,嗯，我知道了。,我每次都是按时还款的。,马上就还。,肯定可以还上。,钱已经在卡里了。,两天时间可以还。,可以。,没问题。,我已经还了。,两天时间还不上。,你们利息太高了。,短时间还不了。,我再想想办法吧。,找朋友借不确定什么时候到,家人在帮忙周转，不确定时间,贷款不知道什么时候下来。,公司工资一直没发。,工程款一直没下来。,金额太高了。,我在忙，稍后联系。,资金还没到位。,朋友钱还没转过来。,我在开车，稍后联系。,我这边信号不好。,你那边太吵，听不清。,过段时间吧。钱没到。,工资延迟发了。,父母正在周转。,我在开车，稍后联系。,好的，,我知道了，,我同意。,马上还，,谢谢你，,明天还，,负担小多了。,这两天我就还上。,怎么还？,钱到了，扣款吧。,还是太多了,我接受不了,可以在少点吗,我现在没有收入。,我在住院没那么多。,家里出事拿不出那么多。,我还不起，,我真的没那么多钱,你重新申请一下吧,家里经济差，还不起那么多。,我在忙，稍后联系。,我在开车稍后联系,他出去了我是他朋友,他出去了我是他同事,我想办法发筹钱,短时间还不上,我没那么多钱,我是他哥哥他在忙,我是他姐姐,我尽力去凑吧。,我可以先还一部分。,这样我还得起。,稍等 我马上还，,钱借到就还，,工资到账就还，,贷款下来就还上。,工程款拿到就还。,我明天就可以还，,这两天有事，要过两天。,钱存在卡里，你们扣吧。,今天可能还不上,工资今天没到账,工程款也没拿到。,贷款今天还没下来。,朋友的钱还没借到,父母周转今天到不了。,可以分几期吗？,这期可以少还一部分吗、,我只有一部分，没那么多,现在忙，稍后联系吧。,我在忙，,我在开车,我在开会,我在上班,钱还没到,工资还没发,还没借到钱。,工程款没到手了。,今天临时有事改天吧,贷款今天还没下来
92,2018/6/14 19:49:03,7031秒,链接,直接访问,157.0.103.142(江苏-南京),你打错了,不是本人,正在开车,没有在,在开会,去厕所,刚刚才换的电话,不说话,在忙等等打,提名挂,在开会等等,在忙等等,有什么事,在上班下班聊,在开车等等,不方便接电话,你是谁,不知道啊,你管我是谁,天天打电话来干嘛,你是不是有病,说话大点声音,说普通话,说慢点没有听清楚,我在高速上,不讲话,骂人,有话快说,你猜我是不是,然后那,认识啊,不联系,联系不到,被拉黑,欠我钱不接电话,他在上厕所,他在开车,他出去了,他不在班上,他没有上班,才换的电话不认识,不说话,不认识,拒接沟通,提名挂,没有听说过,不要在打电话过来,张三谁啊 不认识,你打错电话了吧,你说的那个人我都没有听说过,声音大点,说话清楚点,说话慢点,不认识填你名字电话,不认识填你公司电话,为什么不说话,没有联系,联系不到,听不见,提名挂,暂时没有钱,工资不够,金额太高,还不起,做生意失败,网贷太多,欠钱太多,被人坑,投资失败,工程款没有下来,等等处理,去借钱,找父母借钱,在去银行,马上处理,明天处理,月底处理,正在借钱,之前想还款没有方式,没有人联系,暂时没有钱,多会有钱多会还,再说,过段时间,钱网贷太多还不过来,欠钱太多还不过来,有嘛,不是我借,借给朋友用的,钱没有收到,工资还没有发,工程款还没有发,工地几个月才发工资,有钱了就还,我没有说我不还,等等在打,在开车,不正面回答,暂时没有工作上班的,不知道能不能借到钱,可以,没有问题,马上就还,到期就还,前一天就处理,必须的,知道了,在去银行,在借钱,工资马上到账,在借钱,在找父母要,暂时不行,工资还没有发,金额有点高,我在想办法,别人欠我钱在要,暂时没有上班,老板跑了,钱不够,等等在说,信号不好,不说话,明天再说,到期再说,现在没钱,钱没有到账,钱借钱,听不懂,然后那,可以,朋友钱已过来了,在体现,以到银行卡,能接受,马上去银行,钱以到位,等等在说,扣吧,在银行,金额高了,钱不够,朋友钱没有到,父母钱还没有打过来,本金,遇到困难,还可以减免点,钱都被借了,工资没有那么高,工资压了几百,再说,下班说,开会,开车,在少点,本金,不说话,看工资发多少,能不能借到,父母能不能帮忙,好吧,可以先还,可以接受,多少多少自己扣,去借下,多少,下个月一起,工资到了就先还点,朋友钱到就还,马上去银行,工资没有到,没有借到钱,父母不给,身上没有钱,可以在少点,我身上只有那么点,可以月底嘛,等等去医院,没有要到钱,再说,不方便,金额高了,钱不够,预支工资,去借钱,生意不行,晚上再说,随缘,吃过饭再说,没到位
