27,2018/6/14 14:23:15,3919秒,微信,N/A,122.96.41.66(江苏-南京),不是的，他在忙什么事,他现在不在，等会再打过了,我是她朋友，他手机丢我这了,不是，刚办的卡,说了不是，要说多少遍,我不是，你找他什么事,不认识,我是她朋友,我是她家人,不好意思，打错了,是我，现在没钱,是我，什么事？现在困难，等稍微好点再说,是的，刚上班，等发工资,嗯，现在忙，等会回电给你,对，我没钱,是又怎么样，你们高利贷，我不还,哦哦，我看一下app,我知道了，马上处理,是我，我没贷款啊,是的，我不是还了吗,是不是管你什么事,你谁啊,我为什么要告诉你啊,烦死了，天天打电话,去你妈,有病吧！说了多少次,不知道,你说呢？,你那喜欢打，我就不告诉,说什么，听不懂,认识，但很长时间不联系了,是的，我很忙,没空,他的事管我什么事,认识，那又怎么样,嗯，早不联系,对啊！他死了,对对，现在在医院呢,认识，但他是无赖，不会还钱,认识，你来我带你去他家啊,不认识,滚,有病,烦不烦,说了不认识，她妈的不要在打,在打我投诉你,你现在严重骚扰我了,他是人还是什么我怎么会知道,听都没听过,有病,什么什么,听不懂,我不知道,自己找,我很忙,傻逼,不要在打我电话,你他妈说啊,爱干嘛干嘛,不要找我,高利贷,没钱,还了那么多，还有这么多,还不起,刚上班,失业了,欠款太多,家人都不帮,能减免吧,我快被逼疯了,明天处理,等工程款,等发工资,等我有钱的,等朋友的钱给我的,卖房子,在卖车,家里拆迁等款,等我下班处理,有时间去处理,没钱,生活困难,自己都快养不活了,你起诉吧,我又不该罪，你报警啊,傻逼我借干嘛要还,我没想过要还款,生病，实在没钱,等等吧！我什么时候中大奖500万的,不要给我打电话，等过两年自己会还,等等,资金周转开的,现在没有，等有的,我会还,你不要打电话让客服来电,等我朋友借钱给我,时间说不好，总之会还,妈的，说会还的，不要在给我打,你谁啊！我不跟第三方联系,明天给我来电话,可以的,明天还,马上处理,好的,没问题,我保证,等会就让家人帮我还,好好,嗯嗯,一定还,在拖拖吧,时间有点紧,在多给几天,我还没发工资等等,不可能,没钱,刚上班,不能保证,有困难,应该做不到,看看吧,我尽量,我想想办法,不一定,尽量吧,不确定,看朋友钱给不给,看老板拖不拖工资,家人不知道帮不帮我,看房子到时候能不能卖出去,可以,好的,那你申请吧,我尽快处理,帮我拖一天,我想想办法吧,能不能多给几天,我可以,明天行吗,我找朋友借钱,没钱,现在都没钱吃饭,不可以,这么急怎么可能,在给一两个月,今天真没钱,看看能减免多少吧,孩子都快上不了学了,上有老下有小，我一下子怎么弄那么多钱,没办法,我考虑一下,我是她朋友会跟他说的,我让他给你回电话,他不在,我看能不能借到钱,不能保证，尽量吧,忙，等等,现在有事，等会再打，,能减免多少在看看,我不清楚我要跟他本人核实,可以,好的,我想想办法吧,我能少还点吗,明天吧，让我去借,跟家人商量一下,没问题,最少还多少,放心我会还,那我办卡还,现在没有,今天不行,困难的很,能在等等吗,我的钱在外还没要回来,肯定不行要有不会拖到现在,在给几天吧,工资一直没发,家人生病都没钱,不能，你在申请申请吧,看今天能不能发工资,看今天朋友钱能不能拿到,我知道了，等忙完再说,不一定,不能保证，得看工程款到不到,跟家人商量,我看看吧不能保证,我想想办法,我现在在外地，等回去,等雨不下的，我去还
28,2018/6/14 14:32:33,3760秒,微信,N/A,223.104.147.251(江苏-未知),是,不是,你打错了,你谁啊,他不在,不认识,他出去了,他在开车,怎么了,他出去了,嗯，我是,嗯，你是哪位,找我有什么事,你打错了,不认识,刚换的号码,这人谁啊，怎么天天找他,等下打过来，在忙,我在上班，下午打过来,不认识,你大点声，听不见,喂，信号不好,你烦不烦啊，天天打过来,你觉得我是不是,你那边有点吵，听不见,我这边信号不好，等下再联系,喂，喂，喂,不认识他,你打错了吧,你管我是不是了,嗯，认识,嗯，不认识,他怎么了,你是谁啊,以前同事，怎么了,早就没联系了,他跑路了,打麻将认识的,他几年没回家了,等下让他联系你,不认识,打错了,这人谁啊,怎么天天打电话找他,这人是什么地方的,你烦不烦啊，我不认识他,他到底欠了多少钱，天天找他,没听过,忘了，不知道认不认识,刚换手机号,不认识,听不清你说什么,这人是干什么的,这人怎么了,你那边太吵了,你那边信号不好啊,怎么天天找他,他是哪个地方人啊,没听说过,早就消失了,我想分期处理,我先还一部分,能少还一点吗,能不能只还本金,我下个月再还，只还本金,你们帮我把利息减了我就还了,减免之后，我就开始还,能帮我减免多少,给我减免分三次还,不要利息我就还,我等会就处理,我明天就处理,我发工资就处理,我工程款到位就处理,我过几天就还,我月底处理,我过几天自己处理,我这就借钱处理,我卡里有钱你扣吧,我等下把卡号发你扣款,我工资没到账,我工程款没到账,我现在没钱,我什么时候欠你钱了,我没有贷款,过段时间再说,我有钱就自己还,不是我借的为什么要还,我凭本事贷款为什么要还,我又不欠你钱,听不见,我在开会，等下再联系,你那边有点吵啊,等发工资的我自己处理,有钱我就还了,在忙，你发个信息给我,在忙你加下我微信吧,工程款下来就还了,我找我朋友借点看看,过几天就还了,可以啊,肯定到账,绝对没问题,我保证可以还进去,可以，到时候你联系我,到时候我联系你扣款,一定处理好,到时候我肯定还进去,我这就还进去,我一定按时还进去,这么短时间不行啊,工资还没发，没法还,xx天我肯定处理不了,金额太高，我想想办法,没钱，还不了,你不给我减免我就不还,这月还不了，下个月再说,我看能不能借到钱,别人家还有好多欠款呢，还不了,等下个再联系我,我等下联系你,这里信号不好,你那边声音太大，听不到你说怎么,你说话听不清啊,钱到了立马给你打电话,你等下发个信息给我,到时间你联系我,到时候我自己还进去,现在忙，等下我自己还,到时候再说,可以,我同意,谢谢你,等下我就还进去,你这边从我卡里扣款吧,我这就把卡号发给你扣款,把对公账号发信息给我,我这就让我朋友转账,好的我去银行存钱,过半小时你扣款,但还是太多啊,我真没钱,我这边在治病，没收入来源,还能不能再见面一部分,我有钱难道不想还吗,你把app减免金额删掉我就还,你现在起诉我也没钱,银行卡被冻结了，你来我家拿钱,等我钱到账了我不需要减免,还有那么多还不起，没钱,等我和他联系上的,等我下班就去还,把APP金额减了我等下自己还,知道了，有钱就还,我没有银行卡不知道怎么还,APP上不去怎么还,听说本金也可以减免啊,等下我去借钱,钱到位了我就还了,等发工资我联系你,xxx元，我这就还,这我能换得起,等我电话，我自己处理,建行卡有钱你扣款吧,下班我去存钱,等下我找我朋友帮我存下钱,我把钱发给你帮我还吧,6点之前到位,我这就处理,等我半小时,还能在少一点,再给我拖几天,我周六肯定去存钱,我明天发工资，到了就还,再给我一点时间,还差几百块钱,我找朋友借一下不一定够,等我下班的,我钱真不够，你在少点,我想想办法吧,我这边不方便说话,你们几点下班最迟能帮我再拖多少天,还能不能再少一点了,等下我发信息回复你,我在开会,你那边太吵了，听不见,怎么说话断断续续的,等我下班联系你,我这边银行卡丢了,等我和家里联系一下再说
29,2018/6/14 14:40:36,3388秒,链接,直接访问,157.0.103.142(江苏-南京),我不是,你找错人了,他正在卡车,没在,不认识,挂断,是他朋友,是他同事,刚买的手机号,是商店，手机在这里充电,嗯，我是,对，是我,恩恩，找我什么事,我正在上班,我正在开会,下班以后联系你,一会我给你打过去,不说话,和别人说话，手机放在一边,正常沟通,有什么事,你猜我是不是,怎么总是打电话,又是找张三的,他已经不用这个号码了,刚办的手机号码,你是不是有病啊,再打电话我就投诉你,我是他朋友,我是他弟弟,认识,是他哥哥,是他弟弟,是他朋友,是他同事,是他以前的客户,他是我以前的老板,他是我以前的女朋友,他是我以前的员工,他是我的前妻,不认识,张三是谁啊,没听说过,怎么总是找他啊,不是很熟，有什么事,直接挂断,我真的不认识,很久以前只见过一面,怎么可能有人起这名字,有病吧,以前听说过这个人,吃饭的时候见过一面,好像是某某的朋友,有点熟悉，想不起来,好像某个工作的同事，但是只有几天不记得了,听不清楚,你再说一遍,哦，不认识,不要提他了,我也在找呢,马上处理,没有这么多钱,过一段时间还,我可以先换一部分吗,能不能少还点,能不能减免,能不能只还本金,我觉得你们这个费用不合理,你们给我造成的影响怎么算,我以前还的怎么算,马上处理,我现在怎么还,现在多少钱,我发工资再处理行吗,我是**原因没有还，结束后马上还,你给我一个账号吧,我给你一个账号你直接扣款吧,你怎么才打电话，一直联系不上你们,我月底就处理,15号处理,我忘记了,我要查询一下是否有这个欠款,现在没有钱,你们这个钱是不合法的,直接起诉吧,我要找上一次联系我的那个人,破产了，没有办法还了,别人欠钱我的钱要回来就还了,工程结束，结了工程款就还,你从卡里扣就行了,你挂了电话，我现在还钱,我让**给我还一下,朋友转过来就还上,你给我一个对公账户,我正在去银行的路上,我提现到账就处理,我去找朋友借钱处理,等放假我回家处理,等我补回来身份证处理,下个月处理,可以,保证处理,放心肯定还上,发誓，如果处理不了,到时候你直接在卡上扣款就行了,我筹到钱马上联系你,到时候你提前给我打电话说一声,不可以，我到**时间才能有钱,不用，你在**天和我联系就可以了,你记一下这个电话，如果联系不到我，找他也可以,这段时间可能不行,没有这么多钱，我在想想办法,到时候可能不行，我找朋友再借一下吧,看看到时候能有多少钱我先还上,这金额太高了，我在想想办法,是这样啊，这么短的时间可能不行,可能不行，我的工程结束以后可能会拖延几天,不行，这钱我需要我的工资和家人的工资，他们那时候不能发工资,可能不行，我的房子贷款可能下不来,好的,到时候看看吧,信号不太好，再说吧,我现在在忙，你以后再联系我,我一会给你打过去，这是你的电话吗,你用手机给我发个信息吧,你加我微信说吧,我这几天比较忙。过几天联系我,好的，好的，好的,嗯，嗯，嗯,行，行，行,可以,同意,减免多少,这样子，我就还得起了,只要减免下来我肯定处理,上次就是不同意减免我没有还款的,好的，我马上找家里借钱,你给我一个凭证，我找家里人要钱,放心，肯定处理,那就太感谢你了,还是太多了,我实在没有那么多钱,还可以再减免一些吗,我要分期处理,如果我有钱就直接还了,不差 这点钱,上次和我说的是***元,我朋友和我一样的只还了***元,我朋友借的比我时间还长，不还也就这样了，你再给我少点,如果不能少点，我就不还了,我考虑一下,我去借一下,我再去凑凑,我问一下我朋友,我在咨询一下,我还差点，,我是他朋友，我转告他,我是他哥哥，转告他,可以，但是要等到下个月,我尽量处理,我可以显卡xx元,我可以先还1期,先还部分,这些我还内个还得起,我找朋友借钱还上,我找家人借钱还上,我找哥哥借钱还上,我找姐姐借钱还上,我找老板预支工资还上,好的，没问题,可以少还一点吗,可以多延期久一点吗,明天你查账就行了,能不能分期啊,等我发工资再处理,晚上找朋友借钱,晚上下班去存钱,晚上回家找父母要钱,晚上找老板要钱,晚上找朋友 再去凑点,好的，我存进去告诉你,好的，你到晚上7  8点联系我,12点之前处理进去就行,我让我朋友帮我转进去,我让我哥哥帮我转进去,我让我姐姐帮我转进去,我让我同学帮我转进去,我现在不方便，过会转过去,等等就处理,我在开车，找到银行就处理
30,2018/6/14 14:41:45,2058秒,链接,直接访问,157.0.103.142(江苏-南京),我不是,是,你是谁,找他干嘛,我是他家人,是他朋友,他出去了,他电话号码给我了,他现在在医院,打错了,嗯,是的,你谁,你干嘛,什么事,我在上班,你加我微信 我在忙,你是哪位,你好,怎么了,你猜我是不是,你找他干嘛,你问我干嘛,你再说一遍,我这是公司电话,哦 怎么了,好的,风太大,听不清,一会打过来,我认识,我是他姐姐,我是他父母,我是他哥哥,我是他叔叔,我们之前是同事,我们是初中同学,我们是大学同学,我们只有一面之缘的朋友,我是他父母的朋友,不认识,你打错了吧,他怎么会有我的号码,你们怎么会打我电话,没有印象,没听说过,这名字太好笑了,你们是哪里,知道了,没听说过,风太大,天气好,下雨呢,开车呢,问我干嘛,你管我认不认识,怎么有我号码,我不知道,不要打我电话,上班呢,现在没钱,可不可以只还本金,可不可以分期,怎么利息这么高,当时贷款没说这么高利息,怎么回事,可以先还一部分吗,少还一点,金额太多,现在没钱,发工资,一周之内,和朋友周转到就处理,月底,明天处理,下个月,给我时间,我知道会处理的,放心,15号发工资,明天,下午,马上,在银行,在高速,在山里,在医院,月底,有时间就处理,发工资就处理,等会打过来,多少欠款,知道了,之前没钱,还有其他债务,过几天看看,下个月看看,三个月,听不清,在开会,可以,说到做到,现在有钱没问题,发工资就处理,马上处理,我保证,欠钱一定要还的,没问题的,绝对没问题,肯定行,好像不行,我看看吧,换不了,金额高,没钱,我想想办法,我周转一下,我考虑考虑,我知道了,好的,我晚上联系你,明天联系你,信号不好,听不清,我知道了,好的,我在开车,我在外面,我在医院,我在开会,好的,谢谢,我尽快筹钱,我下午联系你,没问题,我还的上,一定配合你,可以,我同意,放心,还是太多了,我实在没钱,我还在医院,老婆辞职了,可以再减免一些吗,我没有工作,朋友不借给我,没钱,孩子在医院,父母在医院,好的你申请吧,我看看吧,我尽量吧,我考虑考虑,我周转看看,天气很好,我是他姐姐,我是他朋友,我是他父母,我问问看,可以,没问题,放心,部分还的起,一个月,半个月,一周,三天,明天,月末,少还一点,换一部分,本金,延期,怎么还,申请一下,好的,放心,我同意,好的,你吃饭了吗,我在开会,我在上班,哦我知道了,行 你放心,一定处理,没问题的,一个月,月末,发工资
31,2018/6/14 14:52:18,3376秒,微信,N/A,223.104.147.241(江苏-未知),不是,是,不认识,秒断,骂人,我是他朋友,他家人,女朋友,我是他同事,我会告诉她,是,有事情吗,我忘记了,我没有贷,我现在在上班,我在忙,发信息告诉我,我马上下载看看,没人联系我啊,你之前怎么不打电话,说家乡话,听不清楚,你不会核实啊,骂人,你觉得我是不是,不说是不是 直接问什么事情,你问我 我怎么知道,号码换人了,你有病啊 天天打,秒断,我认识,我会转告,我跟他没联系了,我打电话问问他,我是他表姐,我是他朋友,我是他同事,知道了 会告诉,朋友的朋友,知道名字不熟悉,不认识,挂断,认识没联系,没听过,你觉得我应该认识吗,有点印象,你怎么知道我号码,下次不要给我打,你要找谁 给我打干嘛,我没办法转告,你认识 你自己找,说家乡话,说听不清楚,不知道,找我干嘛,不说认不认识 问什么事情,自己找,朋友的朋友,不熟悉,秒断,可以分期吗,帮我减免点吧,我面前只能还一部分,我只能还几百,我没有钱,不还了,之前工作人员骂我了,你们不是要起诉的吗,我会起诉你们的,骂人,我会还,我忘记了 马上处理,我尽量一星期处理,我要等发工资的,给我分期 我现在还得,我15天还,我现在想办法,我15号发工资还,我月底还,我现在想办法,我没贷,我忘记了,我现在没钱,我有钱就还了,我已经逾期了不还了,你们是高利贷,我有钱在处理,我自己本事借的钱 为什么要还,你们不是要起诉我的吗,你们给我家人打电话了不还了,我在开会,知道了,会处理,你先给我利息减免了在说,你们把之前打我通讯录的人 找出来,我想还 只是现在没钱,等我发工资在说,我过班小时会电话给你,我想办法,说自己欠钱太多,可以,到时间我一定还上,我现在就去还,我想办法,我不会让你工作不好做,谢谢你,你把信息发我手机上,我去核实,我会尽快处理,没问题,我尽量去凑,不能少点吗,我能分期吗,你给我点时间,这样啊 我想想,时间不够啊,我要发工资才可以,我在山区 短时间出不去,能给我多久的时间,帮帮忙啊 我是真的困难,信号不好,在上班,我忙完了给你回电话,我在山区,我在开车,我在医院,我等会就去,我下载APP看看,月底这样吧,放心 会还的,好,能减免我一定还,麻烦你,谢谢啊,本金我能够处理,我马上处理,我去银路上,我今天可能处不了,我明天处理,我马上去,金额还是高了,我真的没有那么多,能不能在少点,家人还生病了,有钱不会不还,你这样 我还是还不了,我今天还几百 剩下谁想办法,好的,我能接受,知道了 现在处理,我是他姐姐,我是他朋友,信号不好,你让我考虑,我尽量,我想办法,我在山区,高速开车了,等等回电话给你,我六点下班 你在打电话,可以,先分期,我只能还几百,我尽量去,知道了,我钱要到了 全额还,要不然你借我点还,我吃饭都吃不起了,我有钱会不还吗,你尽量给我往后拖延一下,可以,还多少,分期时间能长点吗,好的,放心 会还,今天没有 明天的吧,我工程款要回来就可以,别人也少我钱,我尽量去借,我刚在看守所出来,我知道了,我会联系你,我现在上班,你微信联系我,我在开车,我在开会,知道了,等等会处理,不要催会还,我下个月就可以了
32,2018/6/14 15:03:06,4464秒,链接,直接访问,157.0.103.142(江苏-南京),不是,张三谁啊,你是不是有病,我不是说过我不叫张三,不认识,你找张三干嘛,你是不是打错电话了,你是谁啊,你哪来我的电话,不说话,你是谁啊,我是张三，有什么是吗,打我电话干什么,在忙有事快说,有什么事等会说，打游戏呢,对是我,嗯,上班呢，挂,是啊怎么了,找我干嘛,你打我电话有什么事？,你哪来的这个电话？,你先说你有什么事，我在告诉你。,不说话,你说什么听不见,奥，我不是,这个号码我朋友给我的,我刚办理的新号码才几天,不认识，这号码我都用了几年了,你是不是有病,认识这么了,他是我朋友,我是他哥,我是他好哥们,以前同事,通过彭有见过几次面,他是我老乡,他是我同学,最近没联系,以前认识,不认识,张三谁啊,有病吧你,没听说过,他是哪里人啊,让我想想啊,张三谁啊打错电话了吧你,张三那个张三啊,不知道张三是谁,你找张三打我电话干嘛,张三你找他干嘛,你找张三打我电话干嘛,你说什么,张三是谁啊,你跟我讲一下他的外号说名字我想不起来,我在开车等会说,我在外面呢等会再打我电话,我在上班下班聊,你是谁啊,讲方言,还是像以前一样分期还吧,家里有人生病没钱还,你们是高利贷不合法利息收太高了,太多了还不起可以少还点吗,我先还一部分吧,我别家贷款都是只还本金你不可以不就不还了,能只还本金吗,我先砸吃饭都是问题没钱还贷款,不是我不还钱在卡里你们不扣还怪我但是利息我不还,我要想办法凑钱能不能少还点,发工资的就处理,月底处理,你帮我看下还欠多少,能不能过段时间现在没钱,明天就还,我先还一部分剩下的下个月全部处理,暂时没钱要等发工资,能申请少还一点吗,后天就还,因为app登不上去了没有还款渠道,知道了马上处理,等工程款结了就还,银行卡被冻结了,现在欠了几十万以后会还的,月底发工资了会处理,忘记了我去看看,朋友用我证件办的等我朋友还钱我就还,我还完了你为什么还打我电话,没钱有钱早还了,银行卡丢了,发工资就还,我现在在上班下班回电话给你,现在没钱先处理部分,银行卡被冻结了过几天解封就还,有一个工程款要结有钱了立马还,卡里有钱但是你们没扣我也没有办法还,知道了下班就处理,现在在开车明天我会还一部分的,现在有事等会再打我电话,绑定的卡丢了我会重新办张卡的,十五号发工资还,月底发工资还,我现在app上就还,钱在卡里你们扣吧,明天上午11点前,明天下午5点前,等借朋友的钱到账了,好的么问题,知道了到时候肯定还,行没问题,不行要到月底,没钱过段时间,时间太短需要多几天,行没问题,现在没钱,等我有钱了肯定立马还,你别催了我知道了,你不是已经说过了吗肯定会还的,这几天不行,不行下个月才能还,知道了,行,没问题,你放心,待会再说在开车,我现在忙待会回你电话,我在上班下班聊,晚上再说,发工资就还,朋友钱到了就还,谢谢你啊,行我想办法借钱,知道了,这是最低的了吗,不能再少了吗,这样啊我看看吧,没问题,我在想想,可以,好的,太多了,我实在没有呢么多能不能再少点,多少多少我就还,我现在是在没钱,我考虑考虑,待会再说,可以不过要等我有钱的,我知道了,不行太多了,知道了那等我有钱了就还,知道了,好的,没问题,过几天的,等会再给我打电话,等我发工资再说,等我和家里人商量下,我想想办法,行我会想办法的,张三不在我是他哥,知道了,行,我想想办法,会处理的,好，现在就处理,那我明天就先还部分,那我月底发工资处理部分,先还部分可以,我今天先还几百,我明天先还几百,奥,现在没钱,明天处理,要等发工资才可以处理部分,太多了能少点吗,不行,我今天钱到不了,我要先去找朋友借点,知道了,能不能下个星期,好的,没问题,知道了,会处理的,我看看,我也不知道朋友钱今天能不能到,等我下班就处理,我想想办法,今天一概能处理部分吧,行没问题
33,2018/6/14 15:07:17,2451秒,微信,N/A,117.136.66.231(江苏-未知),不认识,什么事,干嘛,你是谁,不是,发错了,别找我,现在有事,稍后联系,骂人,是的,什么事,干嘛,你是谁,现在忙,别再找我了,稍后联系,别再找我了,不知道,骂人,刚吃过,不知道,你猜,听不到,唱歌,赌博,开车,吃饭,骂人,秒断,我认识,你是谁,怎么了,干嘛,朋友,同事,家人,好久不联系了,他在干嘛,骂人,他认识,发错了,别找我,怎么又找他,早就说过了不认识,不要找我了,再打我投诉了,你们什么意思,骂人,说过多少遍了,不好,你猜,不知道,哈哈,开车,吃饭,睡觉,骂人,唱歌,天气不错,多少钱,本金多少,太多了,高利贷啊,没有那么多,只愿还本金,我要减免,告我去吧,要分期,骂人,欠多少,本金多少,利息多少,可否减免,怎么还,账号多少,逾期多久了,是么时候还,怎么联系你,加微信,没钱,没空,不想还,你来拿啊,凭本事借的,利息高,太麻烦,不会还,还没借到钱,骂人,可能,不一定,大概,也许,看情况,我想想,考虑一下,暂时没有,等等,骂人,可以,好的,到时联系,想想办法,保证,确认金额,确认时间,确认还款方式,确认联系方式,确认负责人,不能,办不到,暂时没钱,时间太短,还要些时间,到时再说,时间太紧,不可能,那我就不还了,骂人,不一定,看情况,呵呵,也许吧,不好说,到时再说,再联系,开车,吃饭,骂人,可以,谢谢,免多少,好的,一定,明天呢,再协商,好吧,现在想办法,不相信,还不了,没钱,办不到,再缓缓,明天,开会,下次在申请,不一定,有困难,骂人,再说,不知道,吃饭,开车,睡觉,唱歌,想想,问问家人,考虑一下,答非所问,先换一部分,分期还,只有这点,先表达一个诚意,放心,剩下明天,等查到账了再还剩下的,只有这些,再去借,想办法,没钱,到时再说,不相信你,利息高,要见面,到时一起还,不可能,不接受,考虑一下,骂人,不知道,看情况,考虑一下,吃饭,开车,睡觉,唱歌,天气,看心情,骂人
