序号,提交答卷时间,所用时间,来源,来源详情,来自IP,第1题(1),第1题(2),第1题(3),第1题(4),第1题(5),第1题(6),第1题(7),第1题(8),第1题(9),第1题(10),第2题(1),第2题(2),第2题(3),第2题(4),第2题(5),第2题(6),第2题(7),第2题(8),第2题(9),第2题(10),第3题(1),第3题(2),第3题(3),第3题(4),第3题(5),第3题(6),第3题(7),第3题(8),第3题(9),第3题(10),第4题(1),第4题(2),第4题(3),第4题(4),第4题(5),第4题(6),第4题(7),第4题(8),第4题(9),第4题(10),第5题(1),第5题(2),第5题(3),第5题(4),第5题(5),第5题(6),第5题(7),第5题(8),第5题(9),第5题(10),第6题(1),第6题(2),第6题(3),第6题(4),第6题(5),第6题(6),第6题(7),第6题(8),第6题(9),第6题(10),第7题(1),第7题(2),第7题(3),第7题(4),第7题(5),第7题(6),第7题(7),第7题(8),第7题(9),第7题(10),第8题(1),第8题(2),第8题(3),第8题(4),第8题(5),第8题(6),第8题(7),第8题(8),第8题(9),第8题(10),第9题(1),第9题(2),第9题(3),第9题(4),第9题(5),第9题(6),第9题(7),第9题(8),第9题(9),第9题(10),第10题(1),第10题(2),第10题(3),第10题(4),第10题(5),第10题(6),第10题(7),第10题(8),第10题(9),第10题(10),第11题(1),第11题(2),第11题(3),第11题(4),第11题(5),第11题(6),第11题(7),第11题(8),第11题(9),第11题(10),第12题(1),第12题(2),第12题(3),第12题(4),第12题(5),第12题(6),第12题(7),第12题(8),第12题(9),第12题(10),第13题(1),第13题(2),第13题(3),第13题(4),第13题(5),第13题(6),第13题(7),第13题(8),第13题(9),第13题(10),第14题(1),第14题(2),第14题(3),第14题(4),第14题(5),第14题(6),第14题(7),第14题(8),第14题(9),第14题(10),第15题(1),第15题(2),第15题(3),第15题(4),第15题(5),第15题(6),第15题(7),第15题(8),第15题(9),第15题(10),第16题(1),第16题(2),第16题(3),第16题(4),第16题(5),第16题(6),第16题(7),第16题(8),第16题(9),第16题(10),第17题(1),第17题(2),第17题(3),第17题(4),第17题(5),第17题(6),第17题(7),第17题(8),第17题(9),第17题(10),第18题(1),第18题(2),第18题(3),第18题(4),第18题(5),第18题(6),第18题(7),第18题(8),第18题(9),第18题(10),第19题(1),第19题(2),第19题(3),第19题(4),第19题(5),第19题(6),第19题(7),第19题(8),第19题(9),第19题(10)
1,2018/6/13 13:37:46,5386秒,手机提交,直接访问,125.69.41.63(四川-成都),我不是,对不起，你发错了,不是,你找错人,不是，你找错人,不,你找错人了,你打错了,他在开车,他出去了,是的，请问有什么事,是的,我是,嗯，有什么事,我是，有什么事啊,嗯嗯,嗯,是,嗯，我是,我是，干嘛,不好意思，没听清楚,什么，没听清,没听清楚,没听清,没听清楚，请再说一遍,没听清，请再说一次,你找谁,什么事,什么,干嘛,不是，找他干嘛,不是，他是我xx,他是我弟,他是我弟，找他干嘛,什么事啊,找他干嘛,认识,认识，找他干什么,认识，找他干嘛,他出去了,不认识,你打错了,不认识，你打错了,没听说过,你打错了,不知道,没听过这名字,不知道这是谁,你打错了，不认识,不认识，你打错了,风太大，没听清楚,太吵了，没听清楚,太吵了，你说什么,你说什么,我在外面有事,现在有事,什么？,你说什么？,你在说什么？,嗯？,能不能少点,太高了，能少点吗,太高了，能在少点吗,太高了，能少还点吗,太高了，能减点吗,太高了，能优惠点吗,能少点吗,能优惠点吗,有什么优惠活动吗,我可以先还一部分吗,好的,好，我xx时候还,我月底就还,我到期就还,我马上还,我到时间就还,马上还,我马上处理,我等会处理,我等会还,过段时间还,过段时间再说,我不欠钱,我看看,我考虑一下,我现在没钱,我现在没钱，过段时间还,我现在没钱，我想想办法,我先去想想,我先考虑一下下,我有事,我在开会，等会打给你,我听不清,听不清楚,你说什么？,你说什么，再说一次,啥子,啥子事情,我有事哦s,等会打过来,能,好的,可以,可以的,好,好，到时还,嗯嗯,嗯,嗯嗯，到时还,嗯，到期还,这可能过段时间,过段时间,过段时间还,过段时间再说吧,手头紧，过段时间,我考虑一下,我考虑考虑,我看看,我想想,容我考虑一下,有事哈,我待会联系你,我等会联系你,等会打给你,我等会打给你,现在有事哈,你待会打给我吧,我有事,现在很忙,现在很忙不方便接电话,可以,好的,没问题,可以的,嗯嗯,嗯，没问题,嗯，好的,嗯嗯，好的,嗯，可以的,嗯嗯，可以,太多咯,太多了,我没那么多钱,还不了,我没钱，还不了,可以过段时间还吗,过段时间还,手头紧,不得行，没钱,没钱,我是她姐姐,我是他哥哥,我是他爸爸,找他干嘛,找他有事吗,找他有什么事情,他出去了,我是他哥，什么事,他在忙,他不在,好的,可以,我马上还,等会就还,马上处理,马上打过来,嗯嗯，可以,嗯嗯，马上打过来,嗯嗯，马上还,好,可以少一点吗,可以在过段时间还吗,现在没钱啊,手头紧,手头紧，可以延期吗,可以在等段时间吗,可以宽限一个月吗,在等一个月还,实在没钱,实在穷啊,我不方便,现在忙,你打错了,不方便，稍后联系,等会打过来,我在开会,我在开车,没时间,稍后联系,等会打给你
2,2018/6/13 13:39:03,8011秒,链接,直接访问,125.69.41.63(四川-成都),我不是得,我不是,我不是的哈,我不是你要找的人,我不是张三,我不是张三，我是王麻子,我不是你想要找的人,我是他的朋友，请问你找他什么事,你是哪个？我不是张三,你是哪个？你找错人了,是的哈,是的哈，请问你找我什么事,是的哈，请问你找我有啥子事情,你找我干嘛,找我什么事情,你是谁？为什么有我电话？,没错，就是我,对，我是张三,嗯，你找对人了,嗯，是的,太吵，听不清,听不清楚你说话,你咋个老打我电话哦,你烦不烦人,不要给我打电话了,你这个人好讨厌,我今天心情烦，不想和你说话,你烦人得很,你烦得很,你好烦,嗯，我认识他,嗯，我认识他，我是他朋友,嗯，我认识他，我是他好朋友,嗯，我是他朋友,嗯，我是他好朋友,嗯，他是我邻居,认识，他是我隔壁,认识，他是我同学,认识，他是我仇人,认识，他是我老师,不认识,不晓得,不知道,没听说过这个人,没听说过这个名字,没听说过此人,好难听的名字，不晓得是哪个,不晓得是哪个,不知道是哪个,这个人是哪个嘛，不认识,我在洗衣服,我在扫地,你是哪个嘛,你咋个老打我电话哦,我今天心情不好,我今天心情不好，哪个都不想理,不要给我打电话了,我现在很忙,我现在很忙，不方便接电话,我现在在开会,还款数额有点高，手头有点紧，能不能宽松一下,要还的钱太多，一时半会没那么多钱还，先还一部分，可以不,还款数额有点高，一时半会没那么多钱还，先还一部分，可以不,要还的钱太多，手头有点紧，能不能宽松一下,手头紧，没那么多钱还，可以少点不,最近手头紧，没那么多钱还，可以少点不,近期手头紧，没那么多钱还，可以少点不,买了房，没得多的钱了，能不能分期还款,最近买了房，没得多的钱了，能不能分期还款,近期买了房，没得多的钱了，能不能分期还款,放心嘛，这两天就还,放心嘛，最近几天就还,没得问题，这两天就还,没得问题，最近几天就还,好的，这两天就筹钱,好的，最近今天就筹钱,我大概三天以后还,我大概两天以后还,我明天就还,很快就还钱,手头紧，没钱,不想还,没钱还,手头没钱了,最近不方便，手头没钱,最近不方便，不想还,最近没钱还,买了房，没钱了，还不上,投资了，没钱了，还不上,走投无路，没钱还,嗯，我考虑考虑,我考虑考虑,听不清楚你说什么,我待会给你打过来,现在忙，没时间,在开会，没时间,抱歉，听不清楚你说什么,听不清你说什么,你干嘛那么无聊,我忙,是的，没问题,是的，保证没问题,没问题,保证没问题,这两天就还,好的，这两天就可以还款,是的，我这两天就筹钱,是的，我会尽快还钱,不用担心，这两天就还,好的，我准备下款项,时间太仓促了，来不及,时间紧，多宽限几天,你们催得太紧了，这两天恐怕没时间筹备款项,要还的金额太高了，一时半会还不上,时间太仓促了，来不及筹备那么多钱,时间紧，多宽限几天，给我事件准备,时间紧，请给我多点事件准备,能不能分期付款,能不能打个折扣,多给我些时间准备,哦，这么回事啊，我待会联系你,这么回事啊，现在忙不开，待会联系你,好的，现在不方便，待会联系你,我的信号不太好，我待会给你回话,现在忙，待会联系你,刚没听清，你可不可以重复一篇,好的，事情知道了，我想想后再打给你,好的，事情知道了，我想想后再联系你,好的，我想想后再联系你,好的，我待会联系你,嗯，可以,可以，如果这样的话，可以,好的，那我就没问题问题了,那我就没得问题了，可以还,好的，我接收,好的，我愿意,不错，我接收,不错，我愿意,太好了，那没得问题,太好了，这两天就还钱,利息不多，金额还是那么高，不得行,本金还是那么高，没得办法,本金还是那么高，不行,本金还是那么高，不得行，能不能再减免,利息并不多，减免了也起不了作用,利息扣除了还是没得钱还,现在房贷，车贷都是钱，没得多的钱,现在生病了，看病也要钱，没得多的钱的,供娃娃读书，没得多的钱,刚还了银行贷款，没得多的钱,你是谁,你是哪个,没听清,信号不好,我听不清你说话,我心情不好,我心情糟糕,我不想理你,不要给我打电话了,你好讨厌,好的，我今天还这部分钱,嗯，我今天就还这部分钱,好的，有时间了我把这部分钱还了,好的，有时间我去汇款,嗯，有时间了我把这部分钱还了,嗯，有时间我去汇款,可以，没问题,可以，我接收，我待会去汇款,可以，没问题，我待会去汇款,好的，我待会就去汇款,今天没空,今天没时间,今天陪娃娃，没空,今天在外地，没空,生病了，在医院，没时间,不接受，不想还,今天搞不赢了，能不能延期到明天,来不及了，还在外地,来不及了，还在医院,来不及了，现在在忙,我考虑考虑,我再思考下,给点时间，我考虑考虑,给点时间，我再思考下,给点时间，我考虑下,给点时间，我思考下,听不清,我不方便,不要烦我,在忙，不要烦我
3,2018/6/13 13:40:05,6163秒,微信,N/A,171.210.52.89(四川-成都),不是。,我不是。,没这个人！,找错了！,这没这个人！,你号码打错了！,号码错了。,搞错了。,搞什么飞机？没这个人。,搞什么？打错了！,嗯。,是的，啥事？,是我。,找我干嘛？,恩。,是，是。,对。,对头。,就是我。,是的，是我。,啥？,你猜猜？,你说呢？,听不清。,谁？,找谁？,不知道！,神经病！,搞不清。,什么？,嗯，认识。,是的。,认识啊？,我是她哥，啥事？,嗯，啥事？,知道，咋了？,多年的朋友了，咋了？,认识很多年了。,不太熟，还好吧。,还可以吧。,不认识。,没见过。,没听过。,不晓得。,不知道她。,没听说过。,从没听过。,不知道。,不认识她。,没见过她。,啥？,我听不懂？,听不见？,啥，啥？,你说啥？,今天风很大。,有点吵，听不到。,啥子？,不知道你说啥？,不懂。,最近手头不太宽裕，少点行吗？,少还点可以么？,少点吧？,减点行嘛？,少点马上还。,太多了，还不起。少点吧。,周转不过来，少点吧？,给打个折吧？,先还一部分行吗？,先少还点，过些天再还剩下的，可以吗？,不好意思忘记了，等下就还。,我想还来着，可怎么还？,哦，马上还。,马上处理。,等下，多两分钟就还。,哦，今天有点忙，明天就处理。,这就去银行打款。,你们帐号多少，我马上打过来。,不好意思，耽搁了。等下就弄。,知道知道，马上就转。,我没钱还！,我没欠钱，你们找错了人了！,还不起！,我没钱！,找错人了！,现在没钱，二天再说。,还不了，没钱！,下个月再说！,没得还。,还不了。,啥？,你说啥？,在开会，晚点再说！,听不到你说啥。,什么？,什么，什么？,信号不好！,现在不方便，晚点再打。,啊啊？,雨太大，听不见。,好的，没问题。,一定，一定。,绝对没问题。,绝对还。,行。,OK。,好，好。,记下了，一定还。,相信我，没问题的。,OK。,我再想想。多两天？,办不到哦。多给几天吧？,再多给我一些时间吧。,不得行哦。,搞不定哦。,再宽延一个月吧？,时间太短了……,这么短的时间，凑不齐。,再多给点时间？一定还的。,多给两天吧？,啥？,听不清？,等下我给你打回来。,开会呢，不方便。,现在不方便，晚点再说。,啊？啥？,信号不好，重新打？,哪天？,多少？,等我一下，我给你打回来。,好的好的。,这，可以有。,太好了。,多谢多谢，帮大忙了。,这样就没问题了。,这下就好多了。,没问题，没问题。,行，行。,好，好！,太棒了！,还是太多了。,再少点吧！,周转不开啊，再多减点吧！,再减点吧，还是太多了。,利息才多点啊，再免点吧。,多免点，还是还不了呀。,不得行，还是太多了。,麻烦你，和你们经理再多争取点减免吧。,求求您，再多减免些吧。,还是做不到哦，多两天吧？,啥？,听不清？,可以减多少？,啊？免什么？,信号怎么这么差？,您再说一遍？,麻烦您再重复一下？,信号不好，等下我打回给你。,等我一下。,等等，我换个地方。,好好，我先还这个。,这样好多了。,这个当然没有问题。,行，等下就还。,可以有。,可以，马上弄。,好的，好的。,没问题。,嗯，现在就去银行还。,OK，马上打款。,还能少一点吗？,再少点吧。,再多给点时间？,今天没时间，明天可以么？,我再想想办法？,还得再减点呀！,再多给我两天时间？,还是太多了，搞不定哦。,再缓缓吧？,多少点吧？,现在马上要开会，晚点再说。,听不清，多少？,现在不太方便，等会我给你打回来。,信号不好，我换个地方。,明天再打给我。,过两天再说。,稍等，我进电梯了。,啥，啥？,多少？啥时间？,晚点说。
4,2018/6/13 14:06:56,9599秒,链接,直接访问,125.69.41.61(四川-成都),不是,有没有搞错，这是谁啊,不认识,打错了,别骚扰,他在地下,神经病,我不是,你找错人了,他正在开飞机,是，对,嗯嗯,有啥事儿,有何贵干,在开会哈,在上班哈,现在有事在忙,喂，恩,你要干嘛,恩，你卖保险的？,信号不好,太吵了，听不到,说啥呢,雨太大，听不清,你猜呢,你猜猜看,啊？,什么鬼，没听见,今天天气很好,今天天气不好,我认识,我是他爹,我是他爸,我是他老汉儿,等会儿回你,他在附近,他刚回来,他刚出去,他刚走了,认得到,不认识,没听过,不晓得,这谁,无聊,不知道,无趣,无知,无语,没听说过,听不清楚,天气好,今天天气撇,今天天气好,今天在下雨,今天在吹风,雨好大,好大的风,好大的雨,在开会,不想还,没得钱,以后再说吧,可以少还点不,有优惠吗,太多了，没钱,少些吧,能少点不,少点,先还一部分如何,要得,明天处理,马上处理,尽快处理,很快处理,月底就还,下个月就还,明年就还,得行,马上,不想还,没钱,有钱也不想还,不得还哈,我不欠钱,不欠钱,没得还,想得美,你想多了,哪里有这种事情,我想一下,我考虑一下,在开会,在忙哈,不方便哈,有个事情需要处理,外面天气好好,听不清楚,外面风大，听不见,外面下雨,可以,没问题,好,行的,放心,要得,绝对OK,绝对没问题,马上还,行,不行,还不了,来不及,再想想,再考虑,还不上哈,少点吧,可以吗,不得行,没意思,无聊,无趣,无知,无畏,无所谓,等下说,听不清,信号不好,等下联系,如何,好,很好,非常好,非常非常好,可以,不错,同意,坚决同意,谢谢你,这就好了,没意思,没啥影响,再少点嘛,莫法,没得改,莫得搞,你不用想了,没得意思,不想跟你说,懒得理你,再说嘛,难得说,不想理你,不要问了,咋个说嘛,跟你有啥说头,这个很无厘头,你觉得有意思吗,我不晓得,再说吧,好,很好,可以,要得,一定,没问题,一定没问题,绝对没问题,肯定可以的,那就这么定了,不得行,不行,NO,没得,还不上,肯定不行哈,绝对是不行的哈,一定是不行的哈,完全行不同,要不得,不清楚,不想说,不想了解,今天天气还好,今天天气不好,今天天气可以,今天天气不行,外面在下雨,外面在刮风,外面在打雷
5,2018/6/13 14:14:48,6941秒,微信,N/A,125.69.41.67(四川-成都),天刚刚亮,你是哪个？,打错电话了,他去洗澡了,他没带电话,你走开,天王盖地虎,他换号了，你打这个电话12345678901,他欠债电话被我扣留了，你找他做什么?,不要再打骚扰电话了,你是谁,你有什么事,两小时后再打来,我正在看电影,说了不会还钱了，不要再打来了,你是xx催债公司的吧？,yes,whois that,找哪个？,有事快说，有屁快放,天王盖地虎,喊你不要再打了，还打,小样儿，别以为换个马甲就不知道你谁了,滚滚滚,你拨打的用户已关机,听不见你说什么,再说一次,哦，要得，我马上回来。,等我忙完再说,你的声音很难听耶,他去年就失踪了,几百年没联系了,冤有头，债有主，不要再打给我了,从上个月开始就不认识了,已经和他绝交了,他欠我钱，你要帮他还哇?,我也在找他,龟儿子，太恼火了，一天几十个电话打到我这了找他,他是我外甥，怎么了?,又想骗我拿钱去捞他啊？,你走开,鬼大哥晓得他是哪个,我只认识张三李四，不认识王麻子,你说的是不是那个上太空的宇航员啊？,明星的哇，我怎么会认识?,你是骗子吗？,听都没听过这个名字,不认识，你打错电话了,具体长啥样，我认识几十个叫这个名字的,认求不到,你吃饭没有,我在吃饭,天要下雨,女儿要嫁人,再说一次,你是谁,报上姓名来,我是张三,待会再打来,很好很好,我怎会欠那么多,你没搞错了吧，这么多，肯定不会还的,你们是放高利贷的吧，我只借了那么点要我还这么多，我要告你们,1000没有，只有500,这个金额的百分之五十还差不多,你们没有优惠吗,打个折呗,便宜三十个点我就还,最近没这么多钱啊,少还点行不行呢,怎么还法,我马上就转钱过去,哦，这个事情你不说我都忘了，马上还,你找我秘书处理吧，那是我在做测试,这么点钱你们都还记得啊，我以为可以不还了呢，给我支付宝帐号，马上还,今天银行关门了，取不到钱，明天还,我的定期还没到期，到期了马上还,等我去取钱，联系你还是打你这个电话吗？,我可以还钱，但是你怎么证明你是这个公司的呢？,马上还钱，不要给我上征信记录哦,要钱没有，要命一条,借的时候说是不用还的,不还了,这个钱我已经还过了,我还在开会，你明天打来,我在开车，不能接电话了,这点钱就不还了吧，你们大公司有的是钱,再借我点，筹齐整一万再还,李四借我钱还没还，他还了我就还你们,信号不好，听不见你说什么，我挂了,张三借了我钱，不知道他什么时候还我,又不是不还你们这点钱，一天到晚电话不停啊,这点钱我就没放在心上过,我这里有台风，等过了台风再说,我在健身呢，待会打,明天我们面对面谈一谈吧,我在北京，你们派个人来找我吧,你是谁？你怎么知道这个事情,你们是什么公司，我欠他钱和你有什么关系,我钱过他们钱吗？不太记得清楚了啊,sure,no problem,no issue,好的谢谢你们提醒啊,到时候一定还上,不说了，我还在搬砖，多搬两块，肯定还上,说了到时候还就肯定还，人在做天在看,一言既出，驷马难追，你们就等着吧,这个时间，没问题,时间太长了，今天我就还了吧,不可能,在宽限几天吧,这么点时间，你们是要逼死人啊,说了要还了，但是这个时间太短了,明年还还差不多,本来要还的，还有这个时间限制，那就不还了,还不起了,明天再还,不求还了,永远没得可能,你吃饭了吗？,我还在吃饭呢,我没有借过这么多钱哦,明天再说，现在很忙,等天气好点再说,还有木有商量的余地呢,很好很好,不错不错，我都欠这么多钱了啊,欠钱对我来说是不可能的事情,你怎么不说我欠了一百万啊,没得问题,利息可以减但是今天还不了,我怎么知道你说的是真是假,不错不错，你们总于做了点好事了,立刻马上还,这早这样，我早就还了,可以接受，就是卖血也要还,早就改减免了嘛，这样你们的工作也好开展些,大妹子，太感谢了，总于能清账了,天好地好，不如你们好啊，亲人啊,实在是没钱还啊，再少点都还不了,还是还不起，家里都揭不开锅了,一件衣服都穿了几年了，那里还有钱还啊,都是被你们害了，你们不借我钱，我也不会去赌了，还想要我还钱，做梦,没得可能还钱了，人都要卷脚了,电话都要欠费了，你们不要再打了,前面的钱都还没还，你们这个钱我更还不起了,再少个一半我就还哦,真的是还不起啊,你们当初不是说了是普惠大众吗？那就应该不还了啊,天好蓝,地好绿,鸟儿在飞翔,鱼儿在游泳,我的钱在哪儿呢,路边有垃圾还要人去检,不忘初心，互励前行,捋起袖子加油干,人人争做活雷锋,明明很想你,可以,没问题,马上还,发账号给我吧,早这样就对了,快点发卡号来吧,一部分是多少呢？,这点钱我还是还得起的,要得嘛 可以还,早这样我就不用昨天去卖血了,今天还是不行的，马上要出差了,钱都刚刚拿去买基金了，下周才能赎回,再少还一半，多延期一个月，你看怎么样,再少还点吧,再延期半个月吧,我这有一部二手手机，能抵扣点钱不,银行卡密码忘记了，今天也取不出来啊,为什么不能再延期一个月呢,明明昨天可以还的，你们没找我，今天钱不够了啊,你今天只能还一百，你们看着办吧,我在做事呢,我在上课,在开车不方便,人人为我，我为人人,风好大啊,很好的意思,天气很好,明天再打来吧,真心很忙，不好意思啊，晚点来,我已经买了彩票了，就等明天开奖了
